{
  "$schema": "../../../schemas/sheet-sprite.schema.json",
  "id": "sprite:high-dragon-sister",
  "kind": "sheet-sprite",
  "description": "Dragon-kin (sister) — the High Dragon recolored offline to its kin hue (scripts/bake-dragon-kin.mjs). Reads the baked PNG set under bosses/dragon-kin/sister/. docs/RAIL-COMMAND.md §dragon's kin.",
  "frameSize": {
    "w": 96,
    "h": 96
  },
  "anchor": {
    "x": 48,
    "y": 88
  },
  "directionOrder": ["right", "up", "left", "down"],
  "animations": {
    "idle": {
      "image": "bosses/dragon-kin/sister/idle.png",
      "framesPerDirection": 8,
      "directional": true,
      "fps": 8
    },
    "walk": {
      "image": "bosses/dragon-kin/sister/walk.png",
      "framesPerDirection": 6,
      "directional": true,
      "fps": 10
    },
    "melee": {
      "image": "bosses/dragon-kin/sister/melee.png",
      "framesPerDirection": 6,
      "directional": true,
      "fps": 12
    },
    "firebreath": {
      "image": "bosses/dragon-kin/sister/firebreath.png",
      "framesPerDirection": 16,
      "directional": true,
      "fps": 12
    },
    "launch": {
      "image": "bosses/dragon-kin/sister/launch.png",
      "framesPerDirection": 8,
      "directional": true,
      "fps": 10
    },
    "hover": {
      "image": "bosses/dragon-kin/sister/hover.png",
      "framesPerDirection": 6,
      "directional": true,
      "fps": 8
    },
    "fly": {
      "image": "bosses/dragon-kin/sister/fly.png",
      "framesPerDirection": 6,
      "directional": true,
      "fps": 10
    },
    "death": {
      "image": "bosses/dragon-kin/sister/death.png",
      "framesPerDirection": 9,
      "directional": false,
      "fps": 8,
      "loop": false
    }
  },
  "poseMap": {
    "idle": "idle",
    "walk": "walk",
    "attack": "melee",
    "hurt": "idle",
    "death": "death",
    "roar": "launch",
    "volley": "firebreath",
    "lull": "hover"
  },
  "koota": {
    "traits": ["Transform", "Sprite", "Palette", "Facing", "Animator", "DepthSorted"]
  }
}
